link,title,author,cc
http://books.uc.pt/book?book=1324,"A deficiência em Portugal: Lugares, corpos e lutas",Fernando Fontes,1
http://books.uc.pt/book?book=1323,Medievalismo literário português em contexto europeu,Ana Maria Machado,1
http://books.uc.pt/book?book=1325,O espaço urbano do Porto: Condições naturais e desenvolvimento, J. M. Pereira de Oliveira,1
http://books.uc.pt/book?book=1326,Sequenciação de DNA – NGS: Manual de Boas Práticas,Fernando Regateiro,1
http://books.uc.pt/book?book=1322,Identidade Romana e Contemporaneidade,Nuno Simões Rodrigues,1
http://books.uc.pt/book?book=1321,Memórias em Movimento: História e Trauma nos Cinemas Ibero-Americanos,Iván Villarmea Álvarez,1
http://books.uc.pt/book?book=1318,Theatre About Science. Theory and Practice,Mário Montenegro,1
http://books.uc.pt/book?book=1320,"Medicina Personalizada de Base Genómica: Boas Práticas, Ética e Direito",André Gonçalo Dias Pereira,1
http://books.uc.pt/book?book=1316,O dispositivo mnemónico: Uma história da memória da luta de libertação em Cabo Verde,Miguel Cardina,1
http://books.uc.pt/book?book=1319,Os mundos do (sub) desenvolvimento: histórias do século xx,Miguel Bandeira Jerónimo,0
http://books.uc.pt/book?book=1308,Protocolo Unificado para o Tratamento Transdiagnóstico das Perturbações Emocionais: Manual de Exercícios,David H. Barlow,0
http://books.uc.pt/book?book=1309,Protocolo Unificado para o Tratamento Transdiagnóstico das Perturbações Emocionais: Manual do Terapeuta,David H. Barlow,0
http://books.uc.pt/book?book=1310,"30 anos, 30 antropólogos",Sofia Wasterlain,1
http://books.uc.pt/book?book=1312,A Universidade de Coimbra e seus Estudantes aos Olhos dos Viajantes Estrangeiros (1581-1879): 298 Anos de Fragmentos Literários,Carlos Xavier Reis,1
http://books.uc.pt/book?book=1313,Historiographical Alexander: Alexander the Great and the Historians in XIXth and XXth Centuries,B. Antela-Bernádez,1
http://books.uc.pt/book?book=1315,Mito e drama: Teatro clássico no seu tempo e no nosso,Maria de Fátima Silva,1
http://books.uc.pt/book?book=1314,What’s Hecuba to me? Personajes Míticos y Monólogos Dramáticos Contemporáneos para la Enseñanza Universitaria en Humanidades,Lucía P. Romero Mariscal,1
http://books.uc.pt/book?book=1300,As Relações Luso-Marroquinas no Século XVI: Presença Portuguesa em Agadir e região de Sus (1505-1541),Mohammed Nadir,1
http://books.uc.pt/book?book=1305,Contribuições da Geografia para o Ensino dos Riscos,Carla Juscélia de Oliveira Souza,1
http://books.uc.pt/book?book=1298,"Gaio Suetónio Tranquilo, Vidas dos Césares. Livro VII. Galba, Otão e Vitélio",José Luís Brandão,1
http://books.uc.pt/book?book=1299,"Gaio Suetónio Tranquilo, Vidas dos Césares. Livro VIII. Os Flávios. Vidas de Vespasiano, Tito e Domiciano",José Luís Brandão,1
http://books.uc.pt/book?book=1303,Manuscrito Musical 51 da Biblioteca Geral da Universidade de Coimbra: Música para o Natal (1649) Vol. III.1,Tiago Simas Freire,1
http://books.uc.pt/book?book=1297,"Museu de Arqueologia D. Diogo De Sousa. The Bühler-Brockhaus Donation: Obras-Primas nas Coleções de Antiguidades Gregas, Etruscas e Romanas ",Rui Morais,1
http://books.uc.pt/book?book=1307,Pausânias. Descrição da Grécia. Livro V,Maria de Fátima Silva,1
http://books.uc.pt/book?book=1288,A Oficina de Gil Vicente,José Augusto Cardoso Bernardes,1
http://books.uc.pt/book?book=1293,Cantata de Natal “O Pássaro Azul”,Paulo Bernardino,1
http://books.uc.pt/book?book=1291,Compêndio de Direito Empresarial,Alexandre Dias Pereira,1
http://books.uc.pt/book?book=1294,European Public Sector Accounting,Peter C. Lorson,1
http://books.uc.pt/book?book=1289,"Formação Inicial de Professores, Flexibilidade e Avaliação Educativas: da Teoria à Prática",María Luisa Aznar Juan,1
http://books.uc.pt/book?book=1290,Literatura e Outras Artes em Diálogo: Contributos para uma Didática Transversal,Ana Maria Machado,1
http://books.uc.pt/book?book=1296,O Curso Aristotélico Jesuíta Conimbricense. Tomo III: De Caelo – Parte II,António Guimarães Pinto,1
http://books.uc.pt/book?book=1295,Ter Presente: Arquiteturas em Arquivo,José António Bandeirinha,1
http://books.uc.pt/book?book=1284,Artes Performativas e Intimidade,José Eduardo Silva,1
http://books.uc.pt/book?book=1283,"Cornélio Nepos. Vidas de Epaminondas, Catão e Ático. Fragmentos",Francisco de Oliveira,1
http://books.uc.pt/book?book=1306,"Eritrina, a heroína",Ana Cristina Tavares,1
http://books.uc.pt/book?book=1287,Medicina Genómica: Breve Guia Ilustrado,Fernando Regateiro,1
http://books.uc.pt/book?book=1286,Neurociências e Saúde Mental: Da Essência ao Contexto,António Ferreira de Macedo,1
http://books.uc.pt/book?book=1285,O Centro de Estudos de Química Nuclear e Radioquímica no florescimento da investigação em Química na Universidade de Coimbra,Augusto Correia Cardoso,1
http://books.uc.pt/book?book=1282,Pausânias. Descrição da Grécia. Livro IV,Maria de Fátima Silva,1
http://books.uc.pt/book?book=1281,A Independência e o Brasil independente Vol. I,João Paulo Avelãs Nunes,1
http://books.uc.pt/book?book=1280,A Independência e o Brasil independente Vol. II,João Paulo Avelãs Nunes,1
http://books.uc.pt/book?book=1304,A Saúde no Saber - Um Projeto de Promoção da Literacia em Saúde,Sara Varela Amaral,1
http://books.uc.pt/book?book=1311,Medeia,Maria Helena da Rocha Pereira,1
http://books.uc.pt/book?book=1276,"Obras de Ernesto da Silva, o apóstolo do socialismo - Tomo I: Textos literários. Páginas de crítica teatral e teoria estética (1893-1903)",Beatriz Peralta García,1
http://books.uc.pt/book?book=1277,"Obras de Ernesto da Silva, o apóstolo do socialismo - Tomo II: Artigos jornalísticos (1893-1903)",Beatriz Peralta García,1
http://books.uc.pt/book?book=1278,"Obras de Ernesto da Silva, o apóstolo do socialismo - Tomo III: Escritos políticos, conferências e discursos (1893-1903)",Beatriz Peralta García,1
http://books.uc.pt/book?book=1275,Os discursos do Turismo e o desafio da sua tradução,Vivina Almeida Carreira,1
http://books.uc.pt/book?book=1317,Os Portugueses no Golfo 1507–1650: Uma História Interligada,Delfim F. Leão,1
http://books.uc.pt/book?book=1267,A Produção Dramática no Período Helenístico e sua Influência na Literatura Greco­-Latina Posterior,Fernando Rodrigues Jr.,1
http://books.uc.pt/book?book=1272,Corporativismo: Ideias e Práticas,Luciano Aronne de Abreu,1
http://books.uc.pt/book?book=1268,Essays on Production and Trade in Late Medieval Iberia and the Mediterranean: 1100-1500,Flávio Miranda,1
http://books.uc.pt/book?book=1269,Merleau-Ponty y el cuestionamiento de la metafísica del Sujeto,Davide Eugenio Daturi,1
http://books.uc.pt/book?book=1292,OTHER LANDSCAPES OF CULTURAL HERITAGE(S): history and politics,Nuno Lopes,1
http://books.uc.pt/book?book=1270,Princípios de Microeconomia - Questões e Exercícios,Rita Martins,0
http://books.uc.pt/book?book=1273,European Union as an International Actor: Peace and Security in Narratives and Practices,Maria Raquel Freire,1
http://books.uc.pt/book?book=1259,Defesa contra o Português Amatho,António Guimarães Pinto,1
http://books.uc.pt/book?book=1265,O livro de Valo: Um tratado militar português do século XVI,Ana Paula Avelar,1
http://books.uc.pt/book?book=1257,"COIMBRA, o ressurgimento da Cidade em 1537",Jorge de Alarcão,1
http://books.uc.pt/book?book=1256,"Conto dos Dois Irmãos: Estudo Histórico-Filológico com Texto Hieroglífico, Transliteração e Tradução",Telo Ferreira Canhão,1
http://books.uc.pt/book?book=1261,"Das culturas da alimentação ao culto dos alimentos, Volume I",Paula Barata Dias,1
http://books.uc.pt/book?book=1262,"Das culturas da alimentação ao culto dos alimentos, Volume II",Paula Barata Dias,1
http://books.uc.pt/book?book=1253,Estudar sem melancolia: Reflexões teóricas e aplicadas nos bastidores do sistema literário,Elias José Torres Feijó,1
http://books.uc.pt/book?book=1274,Estudos Coreológicos (2016-2020): Contextos da Dança e da Música Antigas,Catarina Costa e Silva,1
http://books.uc.pt/book?book=1264,Marcadores Discursivos e(m) Tradução III,Cornelia Plag,1
http://books.uc.pt/book?book=1260,Nós Globais: Investigações em curso sobre Questões da Globalização,Pedro Abrantes,1
http://books.uc.pt/book?book=1263,Percursos nas Ciências da Educação: Lugar para a Utopia,Maria Helena Damião,1
http://books.uc.pt/book?book=1252,"Temas, Contextos e Desafios da Investigação Qualitativa em Educação",Cristina C. Vieira,1
http://books.uc.pt/book?book=1255,Une valse à mille temps: Para Cristina Robalo Cordeiro,Marta Teixeira Anacleto,1
http://books.uc.pt/book?book=1254,Vida da Faculdade de Letras 2021-2022,Faculdade de Letras da Universidade de Coimbra,1
http://books.uc.pt/book?book=1240,A Democracia Ateniense em Guerra,David M. Pritchard,0
http://books.uc.pt/book?book=1245,ANTOLOGIA. Francofonias em Diálogo: Dos anos 80 à atualidade,Cristina Robalo Cordeiro,1
http://books.uc.pt/book?book=1258,Cinco Joias de Coimbra: Património Mundial da Humanidade,João Gouveia Monteiro,1
http://books.uc.pt/book?book=1249,Imagologia e Mobilidade - Movidas e Migrações Figuradas  ,Maria João Simões,1
http://books.uc.pt/book?book=1241,Lo Stato capitalista e le sue Maschere,António José Avelãs Nunes,1
http://books.uc.pt/book?book=1246,Miscelânea de Estudos em Honra de Maria de Fátima Sousa e Silva - Volume I,Frederico Lourenço,1
http://books.uc.pt/book?book=1247,Miscelânea de Estudos em Honra de Maria de Fátima Sousa e Silva - Volume II,Frederico Lourenço,1
http://books.uc.pt/book?book=1248,The European Integration Process: Crisis and Resilience in the Aftermath of the Covid-19 Pandemic,António Portugal Duarte,1
http://books.uc.pt/book?book=1301,Palavras Ditas…: Volume I,Fernando Seabra Santos,1
http://books.uc.pt/book?book=1302,Palavras Ditas…: Volume II,Fernando Seabra Santos,1
http://books.uc.pt/book?book=1239,Pausânias. Descrição da Grécia. Livro III,Maria de Fátima Silva,1
http://books.uc.pt/book?book=1227,The “ILO-Chair” at FEUC: Talks on the future of work,Hermes Augusto Costa,1
http://books.uc.pt/book?book=1233,António Jorge Andrade de Gouveia. Um Pedaço de Química Portuguesa,Sebastião J. Formosinho,1
http://books.uc.pt/book?book=1232,Advances in Forest Fire Research 2022,Domingos Xavier Viegas,1
http://books.uc.pt/book?book=1226,Catálogo dos desenhos do Jardim Botânico da Universidade de Coimbra: Coleção do Departamento de Ciências da Vida - séculos XVIII a XX,Ana Margarida Dias da Silva,1
http://books.uc.pt/book?book=1236,Espaços vetoriais (reais): uma primeira abordagem dirigida a estudantes de economia e gestão,Teresa Pedroso de Lima,0
http://books.uc.pt/book?book=1237,Impressões Sobre a Música Portuguesa e outros temas (II),José Eduardo Martins,1
http://books.uc.pt/book?book=1231,O Regime Florestal em Serpins: Exposicão e Critica,Adriano J. de Carvalho,1
http://books.uc.pt/book?book=1234,Redes Científicas da Universidade de Coimbra no Iluminismo,Carlota Simões,1
http://books.uc.pt/book?book=1235,Ricœuriana 2: Ricœur e a Questão da Imagem,Patrícia Lavelle,1
http://books.uc.pt/book?book=1271,Semicondutores e nanoestruturas: uma introdução,Rui César Vilão,0
http://books.uc.pt/book?book=1229,Teoria e desenvolvimento curricular: Caderno Prático,Maria Helena Damião,1
http://books.uc.pt/book?book=1228,Valete Vos Viatores: Travelling through Latin inscriptions across the Roman Empire,Javier Andreu Pintado,1
http://books.uc.pt/book?book=1217,A Universidade de Coimbra e a Independência do Brasil: Catálogo da exposição documental e bibliográfica,João Nuno Calvão da Silva,1
http://books.uc.pt/book?book=1223,Avaliação Multicritério em Processos de Decisão,Luís Cândido Dias,1
http://books.uc.pt/book?book=1224,Boris Groys Philosophical Conversations - Towards Self-Design,Boris Groys,1
http://books.uc.pt/book?book=1222,Traces on The Sea: Portuguese Interaction With Asia,Robert Samuel Newman,1
http://books.uc.pt/book?book=1221,União Europeia como Ator Internacional: Paz e Segurança nas Narrativas e Práticas,Maria Raquel Freire,1
http://books.uc.pt/book?book=1212,As Ifigénias de Eurípides,Ana Maria Inácio,1
http://books.uc.pt/book?book=1213,Bichos Vividos ,Carlota Simões,1
http://books.uc.pt/book?book=1216,[A1+] em Português: manual de português língua não materna,Carla Ferreira,1
http://books.uc.pt/book?book=1211,O Podcast e as novas dinâmicas dos conteúdos sonoros no ambiente digital,Sílvio Correia Santos,1
http://books.uc.pt/book?book=1238,22 Contos Escolhidos,José Viale Moutinho,1
http://books.uc.pt/book?book=1210,Observação dos Ventos. Sociedade & Direito (2010-2022),Paulo Ferreira da Cunha,1
http://books.uc.pt/book?book=1266,Raízes do Censo Consignativo: Para a história do crédito medieval português,Mário Júlio de Almeida Costa,1
http://books.uc.pt/book?book=1207,Curso Jesuíta Conimbricense: Comentário ao De Anima de Aristóteles,Maria da Conceição Camps,1
http://books.uc.pt/book?book=1206,"Obras de Maria Helena da Rocha Pereira X: Recensões Críticas, Notícias e Comentários",Maria Helena da Rocha Pereira,1
http://books.uc.pt/book?book=1208,Pausânias. Descrição da Grécia. Livro II,Maria de Fátima Silva,1
http://books.uc.pt/book?book=1225,"A biblioteca matemática da Universidade de Coimbra (1913-1969): génese, formação e desenvolvimento",Carlos Tenreiro,1
http://books.uc.pt/book?book=1200,A Fé dos Juízes: Inquisidores e processos por heresia em Portugal (1536-1774),Bruno Feitler,1
http://books.uc.pt/book?book=1205,Desafios Curriculares no Séc. XXI,Anabela Santos Fernandes,1
http://books.uc.pt/book?book=1201,"Escritos sobre Filosofia, Ciência e Arte: Egídio Namorado",Egídio Namorado,1
http://books.uc.pt/book?book=1203,Estudos Linguísticos - Volume I: Linguística Histórica e História da Língua Portuguesa,Clarinda de Azevedo Maia,1
http://books.uc.pt/book?book=1209,"Estudos Linguísticos - Volume II: Dialetologia, Sociolinguística e Línguas em Contacto",Clarinda de Azevedo Maia,1
http://books.uc.pt/book?book=1215,I Can´t Breathe  e outros textos,Elmano Sancho,0
http://books.uc.pt/book?book=1202,Plutarco. Como deve o jovem ouvir os poetas?,Marta Isabel de Oliveira Várzeas,1
http://books.uc.pt/book?book=1204,Resistência Patriótica e Revolução Liberal 1808-1820,Ana Cristina Araújo,1
http://books.uc.pt/book?book=1198,A Oficina de Camões: Apontamentos sobre Os Lusíadas,José Augusto Cardoso Bernardes,1
http://books.uc.pt/book?book=1196,A Razão Bem Temperada: Do Princípio do Gosto em Filosofia e outros Ensaios Kantianos,Leonel Ribeiro dos Santos,1
http://books.uc.pt/book?book=1194,"Edificar a Igreja, consolidar o império: A Universidade de Coimbra e os bispos do Brasil (1676 - ca. 1773)",Ediana Mendes,1
http://books.uc.pt/book?book=1195,Ser Clássico no Brasil: Apropriações Literárias no Modernismo e Pós,Tereza Virgínia Ribeiro Barbosa,1
http://books.uc.pt/book?book=1188,1655 Escala em Coimbra: Um jovem jesuíta entre o Ocidente e o Oriente,Noël Golvers,1
http://books.uc.pt/book?book=1192,Bullying. Impactos na Educação: O que sabemos a respeito  da Sobredotação?,Fernanda Hellen Ribeiro Piske,1
http://books.uc.pt/book?book=1191,Pausânias. Descrição da Grécia: Livro I,Maria de Fátima Silva,1
http://books.uc.pt/book?book=1251,"Repensar Portugal, a Europa e a Globalização: Saber Padre Manuel Antunes, SJ – 100 Anos",José Eduardo Franco,1
http://books.uc.pt/book?book=1193,Terrorismo : Legislação Comentada – textos doutrinais,José Manuel Aroso Linhares,1
http://books.uc.pt/book?book=1189,Vida da Faculdade de Letras 2020-2021,Faculdade de Letras da Universidade de Coimbra,1
http://books.uc.pt/book?book=1250,"Vieira, Místico da Ação Global",Eugénia Abrantes,1
http://books.uc.pt/book?book=1190,"História, Empresas, Arqueologia Industrial e Museologia",Irene Vaquinhas,1
http://books.uc.pt/book?book=1185,Magia e Superstição no Mediterrâneo Antigo,Maria do Céu Fialho,1
http://books.uc.pt/book?book=1186,Relatório de Avaliação das Parcerias Erasmus 2014-2019,João Nuno Calvão da Silva,1
http://books.uc.pt/book?book=1187,Temas de história contemporânea,António Rafael Amaro,1
http://books.uc.pt/book?book=1180,A Ilíada Latina,Priscilla Adriane Ferreira Almeida,1
http://books.uc.pt/book?book=1182,A Investigação e a Escrita: Publicar sem Perecer,Paula Sequeiros,1
http://books.uc.pt/book?book=1183,O Jornalismo e a História: Homenagem a Isabel Nobre Vargues,João Figueira,1
http://books.uc.pt/book?book=1181,Vidas Paralelas. Címon e Luculo,Ana Maria Guedes Ferreira,1
http://books.uc.pt/book?book=1178,A UC e a Transferência de Conhecimento e Tecnologia no contexto histórico,André Pedro Oliveira,1
http://books.uc.pt/book?book=1179,Conimbriga Diripitur: Aspetos das ocupações tardias de uma antiga cidade romana,José Ruivo,1
http://books.uc.pt/book?book=1176,Cura Psicossomática e Cura Política em Platão,Luciano Coutinho,0
http://books.uc.pt/book?book=1175,"Experiência, saúde, cronicidade: um olhar socioantropológico",Reni Barsaglini,0
http://books.uc.pt/book?book=1218,Manifesto a Crioulização,Mário Lúcio Sousa,1
http://books.uc.pt/book?book=1177,Manual de Comunicação Clínica,Manuel João Quartilho,0
http://books.uc.pt/book?book=1172,Limites e Limiares: contributos para pensar a sociedade complexa,António Rochette Cordeiro,1
http://books.uc.pt/book?book=1171,Reinventar o social: movimentos e narrativas de resistência nas Américas,Isabel Caldeira,1
http://books.uc.pt/book?book=1170,Vida da Faculdade de Letras 2018-2019,Faculdade de Letras da Universidade de Coimbra,1
http://books.uc.pt/book?book=1169,Vida da Faculdade de Letras 2019-2020,Faculdade de Letras da Universidade de Coimbra,1
http://books.uc.pt/book?book=1166,Design de Serviços: Atividades e modelos,Paula Alexandra Silva,1
http://books.uc.pt/book?book=1174,Diálogos Multidisciplinares: investigação em perspetiva,António Rochette Cordeiro,1
http://books.uc.pt/book?book=1168,1876-1952: Lourenço Chaves de Almeida: Mestre Ferreiro de Arte Vida e Obra,Afonso Chaves de Almeida,1
http://books.uc.pt/book?book=1162,Cadernos do Ceis 20 N.º 28: Ver mais longe: Dois pequenos ensaios sobre Ciência,Pedro Urbano,1
http://books.uc.pt/book?book=1161,"Excellence in Teaching and Learning in Higher Education: Institutional policies, research and practices in Europe",Isabel Huet,1
http://books.uc.pt/book?book=1173,Intervenções e Mediações com Idosos,Clara Cruz Santos,1
http://books.uc.pt/book?book=1167,La gestión de intangibles en el espacio iberoamericano: Construcción de marcas responsables y sostenibles en la economía de la reputación ,João Figueira,1
http://books.uc.pt/book?book=1163,Livros que respiram: pensamento ecológico e solidariedade nas literaturas em português,André Corrêa de Sá,1
http://books.uc.pt/book?book=1164,"Passado, Presente e Futuro dos Direitos Humanos : Após as Comemorações dos 70 Anos da Declaração Universal dos Direitos Humanos 1948 - 2018",João Proença Xavier,1
http://books.uc.pt/book?book=1219,Dez Mitos sobre os Judeus ,Maria Luiza Tucci Carneiro,1
http://books.uc.pt/book?book=1220,Há vila além da Costa. Urbanidade(s) em Cabo Verde no século XIX,Fernando Pires,0
http://books.uc.pt/book?book=1165,Serviços ecossistêmicos e direito: delineamentos para uma teoria jurídica geral e uma tipologia,Alexandre Altmann,1
http://books.uc.pt/book?book=1242,"Utopia Global do Espírito Santo: Cultura, Cultos e Inspirações Utópicas Vol. I",José Eduardo Franco,1
http://books.uc.pt/book?book=1243,Utopia Global do Espírito Santo: Expressões Regionais e Projeções Globais Vol. II,José Eduardo Franco,1
http://books.uc.pt/book?book=1244,"Utopia Global do Espírito Santo: Santidade, Instituições e Património Vol. III",António Manuel Ribeiro,1
http://books.uc.pt/book?book=1154,"Geografia, Turismo e Território: Homenagem à Professora Fernanda Delgado Cravidão",Lúcio Cunha,1
http://books.uc.pt/book?book=1160,Sertões e Outros Mundos,Joel Carlos de Souza Andrade,1
http://books.uc.pt/book?book=1159,"Testemunho, Atestação e Conflito: Balizas da Antropologia Hermenêutica de Paul Ricœur",Maria Luísa Portocarrero,1
http://books.uc.pt/book?book=1145,A fabricação de Alexandre Magno: habilidade política e genialidade militar nas fontes antigas (336-331 AEC),Henrique Modanez de Sant’Anna,1
http://books.uc.pt/book?book=1153,A Poética Calimaquiana e sua Influência na Poesia Epigramática,Fernando Rodrigues Jr.,1
http://books.uc.pt/book?book=1143,Cancro da Cabeça e Pescoço: Aspectos Particulares do Cancro Oral,Isabel Marques Carreira,1
http://books.uc.pt/book?book=1149,Cultura e Sociedade na Europa pós 1945 ,Maria Manuel Tavares Ribeiro,1
http://books.uc.pt/book?book=1142,D. Francisco de Azevedo e Ataíde: Subsídios para a sua biografia,Augusto­-Pedro Lopes Cardoso,1
http://books.uc.pt/book?book=1184,Estudos sobre os Descobrimentos e a Expansão Portuguesa: Volume III,João Marinho dos Santos,1
http://books.uc.pt/book?book=1152,"História da Ciência no Ensino. Revisitando Abordagens,  Inovando Saberes",Ana Luísa Santos,1
http://books.uc.pt/book?book=1151,Mesa dos Sentidos & Sentidos da Mesa: Vol. II,Carmen Soares,1
http://books.uc.pt/book?book=1146,Políticas e dinâmicas educativas,Sara Dias-Trindade,1
http://books.uc.pt/book?book=1147,Retórica e Poética,Belmiro Fernandes Pereira,1
http://books.uc.pt/book?book=1155,Uma Campa é um Buraco Difícil de Tapar: e outros textos,Jorge Palinhos,1
http://books.uc.pt/book?book=1144,Walking & Cycling. Uma Nova Geografia do Turismo,Paulo Carvalho,1
http://books.uc.pt/book?book=1140,A coleção numismática do Museu Nacional de Machado de Castro,Isabel Pereira,1
http://books.uc.pt/book?book=1139,"Apolónio de Rodes. Argonáutica, Livros I e II. Estudo Introdutório, Tradução e Notas",Ana Alexandra Alves de Sousa,1
http://books.uc.pt/book?book=1141,"História Augusta. Vol. II: Vidas de Hélvio Pertinaz, Dídio Juliano, Severo, Pescénio Nigro, Clódio Albino, Antonino Caracala, Antonino Geta, Opílio Macrino, Diadúmeno Antonino, Antonino Heliogábalo",Nuno Simões Rodrigues,1
http://books.uc.pt/book?book=1136,Mesa dos Sentidos & Sentidos da Mesa: Vol. I,Carmen Soares,1
http://books.uc.pt/book?book=1107,Antologia Grega. Epigramas de Banquete e Burlescos: (Livro XI),"Carlos A. M. Jesus
",1
http://books.uc.pt/book?book=1122,Áreas protegidas e gestão territorial: O caso da Serra da Lousã,Paulo Carvalho,1
http://books.uc.pt/book?book=1127,O príncipe ideal no século XVI e a obra de D. Jerónimo Osório,Nair de Castro Soares,1
http://books.uc.pt/book?book=1101,Plutarco. Vidas Paralelas: Aristides e Catão Censor,Joaquim Pinheiro,1
http://books.uc.pt/book?book=1124,"Sob a lente da Ciência Aberta: Olhares de Portugal, Espanha e Brasil",Maria Manuel Borges,1
http://books.uc.pt/book?book=1115,Corps ému / Corpo Abalado: ENSAIOS DE FILOSOFIA BIRANIANA,Luís António Umbelino,1
http://books.uc.pt/book?book=1150,Correspondência - Carolina Michaëlis de Vasconcelos e Ricardo Jorge,Maria Manuela Gouveia Delille,1
http://books.uc.pt/book?book=1137,"Direitos Humanos: novas abordagens, velhos desafios",Isabel Maria Freitas Valente,1
http://books.uc.pt/book?book=1128,O Curso Aristotélico Jesuíta Conimbricense. Tomo III: De Caelo - Parte I,Manuel de Góis,1
http://books.uc.pt/book?book=1117,O Discurso Inaugural do Real Colégio dos Nobres (1766),Ana Isabel Correia Martins,1
http://books.uc.pt/book?book=1121,"A Europa, O Ocidente e o Mar",Isabel Maria Freitas Valente,1
http://books.uc.pt/book?book=1126,Um Fígado Equilibrado é Meio Caminho Andado!,Mireia Alemany i Pagès,1
http://books.uc.pt/book?book=1199,CREATOUR: Catalisando o turismo criativo em cidades de pequena dimensão e em áreas rurais,Nancy Duxbury,1
http://books.uc.pt/book?book=1148,Do Manuscrito ao Livro Impresso II,António Manuel Lopes Andrade,1
http://books.uc.pt/book?book=1131,Eine gesunde Leber – nicht nur was für Streber,Mireia Alemany i Pagès,1
http://books.uc.pt/book?book=1156,Gigantes em cena,Wole Soyinka,1
http://books.uc.pt/book?book=1157,"Instituição  da Gramática ampliada e explicada por António Velez. Tomo I: Morfologia I: paradigmas do nome, pronome e verbo. Rudimentos ou princípios básicos das oito partes da oração.",Eustaquio Sánchez Salor,1
http://books.uc.pt/book?book=1158,Instituição  da Gramática ampliada e explicada por António Velez. Tomo II: Morfologia II: género dos nomes. Sobre a declinação dos nomes. analogia e anomalia. Pretéritos e supinos,Eustaquio Sánchez Salor,1
http://books.uc.pt/book?book=1116,Jurisprudencialismo e Idiomas Vizinhos: Diálogos com Castanheira Neves,António Pinto Monteiro,1
http://books.uc.pt/book?book=1133,"La prochaine fois, pensez à ton foie!",Mireia Alemany i Pagès,1
http://books.uc.pt/book?book=1119,Mundo Ibero-Americano: Entre a Tradição e a Modernidade,António Pedro Pita,1
http://books.uc.pt/book?book=1123,O Património Defensivo De Goa 1510-1660,Nuno Lopes,1
http://books.uc.pt/book?book=1130,Sigues metge del teu propi fetge!,Mireia Alemany i Pagès,1
http://books.uc.pt/book?book=1125,Um Fígado Equilibrado é Meio Caminho Andado!,Mireia Alemany i Pagès,1
http://books.uc.pt/book?book=1132,Un Fegato Sano Ti Porta Lontano!,Mireia Alemany i Pagès,1
http://books.uc.pt/book?book=1120,Utopia Cidadã,Isabel Maria Freitas Valente,1
http://books.uc.pt/book?book=1118,Vinte Meses de Inferno: O meu Reitorado na Universidade de Coimbra (1970-1971),José de Gouveia Monteiro,1
http://books.uc.pt/book?book=1135,Zdravá játra vždy splní své povinnosti!,Mireia Alemany i Pagès,1
http://books.uc.pt/book?book=1134,Zdrowa wątroba przy długim życiu Cię zachowa!,Mireia Alemany i Pagès,1
http://books.uc.pt/book?book=1129,¡Un Hígado Equilibrado Es Medio Camino Andado!,Mireia Alemany i Pagès,1
