link,title,author,cc
http://books.uc.pt/book?book=925,Património Urban(ístic)o e Desenvolvimento: uma década de estudos sobre a dimensão urbana do património,Adelino Gonçalves,1
http://books.uc.pt/book?book=907,Lições de Matemática II,Teresa Pedroso de Lima,0
http://books.uc.pt/book?book=938,Se eu vivesse tu morrias e outros textos,Miguel Castro Caldas,1
http://books.uc.pt/book?book=942,Transparências: linguagem e reflexão de Cícero a Pessoa ,Diogo Ferrer,1
http://books.uc.pt/book?book=1054,The Coimbra Jesuit Aristotelian Course,Mário Santiago de Carvalho,1
http://books.uc.pt/book?book=884,Catalogação e estudo crítico da obra de Manuel Faria àguarda da Biblioteca Geral da Universidade de Coimbra,Paulo Bernardino,1
http://books.uc.pt/book?book=761,A Biblioteca Joanina: Uma biblioteca viva,José Augusto Cardoso Bernardes,0
http://books.uc.pt/book?book=1099,A Cultura Epigráfica no conuentus Bracaraugustanus (pars occidentalis): percursos pela sociedade brácara da época romana vol. II,Armando Redentor,1
http://books.uc.pt/book?book=763,A economia social e civil: Estudos,João Carlos Loureiro,1
http://books.uc.pt/book?book=764,A economia social e civil: Estudos de fiscalidade,Suzana Tavares da Silva,1
http://books.uc.pt/book?book=766,"A Universidade Pombalina. Ciência, Território e Coleções Científicas",Ana Cristina Araújo,1
http://books.uc.pt/book?book=768,Alcafache: 30 anos depois,Luciano Lourenço,1
http://books.uc.pt/book?book=770,Antologia Grega. A Musa dos Rapazes (livro XII),"Carlos A. M. Jesus
",1
http://books.uc.pt/book?book=771,Antologia Grega. Apêndice de Planudes (livro XVI),"Carlos A. M. Jesus
",1
http://books.uc.pt/book?book=772,"Antonino Liberal. Metamorfoses. Tradução do grego, estudo introdutório e notas",Reina Marisol Pereira,1
http://books.uc.pt/book?book=773,Arqueologia da transição: Entre o mundo romano e a Idade Média,André Carneiro,1
http://books.uc.pt/book?book=776,As reformas do setor público. Perspectiva ibérica no contexto pós-crise,Suzana Tavares da Silva,1
http://books.uc.pt/book?book=777,Atlas of Population Health in European Regions,Paula Santana,1
http://books.uc.pt/book?book=783,Controlo da estabilidade orçamental e limites territoriais ao poder tributário segundo a jurisprudência da UE,Suzana Tavares da Silva,1
http://books.uc.pt/book?book=784,Desafios actuais em matéria e sustentabilidade ambiental e energética,Suzana Tavares da Silva,1
http://books.uc.pt/book?book=787,Ensaios ruminantes: sobre a obra performativa de Patrícia Portela,Fernando Matos Oliveira,1
http://books.uc.pt/book?book=788,Estado Social. Constituição e pobreza. Estudos de Doutoramento I,,1
http://books.uc.pt/book?book=789,Estatística para a melhoria de processos: a perspectiva seis sigma,Marco Reis,1
http://books.uc.pt/book?book=790,Estudos de direito da energia,Suzana Tavares da Silva,1
http://books.uc.pt/book?book=794,"Geografia, turismo e patrimônio cultural: identidades usos e ideologias.",Maria Tereza Duarte Paes,1
http://books.uc.pt/book?book=797,Homenagem a António Gama,Norberto Santos,1
http://books.uc.pt/book?book=801,La Bibliothèque Joanina : une bibliothèque vivante,José Augusto Cardoso Bernardes,1
http://books.uc.pt/book?book=803,,Armando Rabaça,1
http://books.uc.pt/book?book=804,Legado clássico no Renascimento e sua receção: contributos para a renovação do espaço cultural europeu,Nair de Castro Soares,1
http://books.uc.pt/book?book=806,Lições de Direito Administrativo,José Vieira de Andrade,1
http://books.uc.pt/book?book=818,O binómio casos fáceis/casos difíceis e a categoria de inteligibilidade sistema jurídico                                                                                                                                                                                                                                                                                                                                                                                                                                 ,José Manuel Aroso Linhares,1
http://books.uc.pt/book?book=820,O Ensino das Línguas Clássicas reflexões e experiências didáticas,Cláudia Cravo,1
http://books.uc.pt/book?book=823,"O livro do tempo: escritas e reescritas. Teatro greco-latino e sua receção, Vol. I",Maria de Fátima Silva,1
http://books.uc.pt/book?book=824,"O livro do tempo: escritas e reescritas. Teatro greco-latino e sua receção, Vol. II - Impressão",Maria de Fátima Silva,1
http://books.uc.pt/book?book=825,O meu herbário de plantas medicinais,Célia Cabral,1
http://books.uc.pt/book?book=829,Oportunidades económicas dos mercados voluntários de carbono no contexto das políticas agrícola e florestal. A Lousã como caso de estudo,Suzana Tavares da Silva,1
http://books.uc.pt/book?book=831,Os Direitos Fundamentais e a sua Circunstância,Ana Raquel Moniz,1
http://books.uc.pt/book?book=834,Os novos desafios da política portuária,Suzana Tavares da Silva,1
http://books.uc.pt/book?book=835,Pagar a conta da cidade,Suzana Tavares da Silva,1
http://books.uc.pt/book?book=836,Pena de Morte I,,1
http://books.uc.pt/book?book=837,Pena de Morte II,,1
http://books.uc.pt/book?book=838,Pena de Morte III,,1
http://books.uc.pt/book?book=839,"Penicilina em Portugal (anos 40-50 do século XX): receção, importação e primeiros tratamentos",Victoria Bell,1
http://books.uc.pt/book?book=841,Pessoas e Ideias em Trânsito: Percursos e Imaginários,Rita Basílio Simões,1
http://books.uc.pt/book?book=842,"Pharmacopea Ulyssiponense, Galenica, e Chymica",,0
http://books.uc.pt/book?book=843,Plauto. Comédia 'O Mercador',Aires Pereira do Couto,1
http://books.uc.pt/book?book=844,Plutarco - Epítome da Comparação de Aristófanes e Menandro,Ana Maria César Pompeu,1
http://books.uc.pt/book?book=845,"Plutarque. Editions, traductions, paratextes",Françoise Frazier,1
http://books.uc.pt/book?book=846,Pólis/Cosmópolis: Identidades Globais & Locais,Carmen Soares,1
http://books.uc.pt/book?book=850,Remédios vários e receitas aprovadas. Segredos vários - Edição do Caderno II do Manuscrito 142 do Arquivo Distrital de Braga,Anabela Leal de Barros,1
http://books.uc.pt/book?book=851,Risco alimentar,,1
http://books.uc.pt/book?book=852,Risco ambiental. Homenagem ao Senhor Professor Doutor Adriano Vaz Serra,,1
http://books.uc.pt/book?book=853,Roteiro Jurídico comparado da eficiencia energética,Suzana Tavares da Silva,1
http://books.uc.pt/book?book=854,Sic itvr in vrbem: iniciação ao latim,,1
http://books.uc.pt/book?book=858,,José Augusto Cardoso Bernardes,1
http://books.uc.pt/book?book=860,Trajectórias de sustentabilidade. Tributação e investimento,Suzana Tavares da Silva,1
http://books.uc.pt/book?book=1138,"Avulsos da História Moderna. Instituições, Pessoas e Conflitos | Miunças 4",Joaquim Romero Magalhães,1
http://books.uc.pt/book?book=781,Cartas a um Pai Natal ambiental,Maria Helena Henriques,1
http://books.uc.pt/book?book=798,"Iberismos: Nação e transnação, Portugal e Espanha (c.1807-c.1931)",Sérgio Campos Matos,1
http://books.uc.pt/book?book=799,Identity(ies): a multicultural and multidisciplinary approach,Ana Paula Arnaut,1
http://books.uc.pt/book?book=814,Marcadores Discursivos e(m) Tradução,Ana Paula Loureiro,1
http://books.uc.pt/book?book=821,O futuro do trabalho em debate: Simulação da Conferência Internacional do Trabalho na Universidade de Coimbra,Hermes Augusto Costa,1
http://books.uc.pt/book?book=822,O Império da Vontade e a raiz cristã da descristianização,António Vitor Ribeiro,1
http://books.uc.pt/book?book=833,"Os dirigentes do PAIGC (Partido Africano para a Independênciada Guiné e de Cabo Verde), da fundação à rutura 1956 - 1980",Ângela Benoliel Coutinho,1
http://books.uc.pt/book?book=848,,Maria Raquel Freire,1
http://books.uc.pt/book?book=861,Vida da Faculdade de Letras 2016/2017,Faculdade de Letras da Universidade de Coimbra,1
http://books.uc.pt/book?book=780,Brasil nas ondas do Mundo: Euro-Atlântico: Espaço de Diálogos,Isabel Maria Freitas Valente,1
http://books.uc.pt/book?book=792,"Fazer e pensar história medieval: Guia de estudo, investigação e docência",Maria de Lurdes Rosa,1
http://books.uc.pt/book?book=808,Lições de Pediatria vol. I,Guiomar Oliveira,1
http://books.uc.pt/book?book=809,Lições de Pediatria vol. II,Guiomar Oliveira,1
http://books.uc.pt/book?book=810,Logística,João Paulo Costa,0
http://books.uc.pt/book?book=815,Memorias de Litteratura Portugueza [1792-1814] Os homens e as letras na Academia Real das Ciências de Lisboa,Eurico José Gomes Dias,1
http://books.uc.pt/book?book=805,Lições de Álgebra Linear,Teresa Pedroso de Lima,1
http://books.uc.pt/book?book=908,Manual técnico do Nadador-Salvador,ISN,1
http://books.uc.pt/book?book=840,Pervivencia del mundo clásico en la literatura: tradición y relecturas,Aldo Pricco,1
http://books.uc.pt/book?book=769,Alguns homens de meu tempo e outras memórias de Jaime Batalha Reis,Elza Miné,1
http://books.uc.pt/book?book=795,História do Galego-Português: Estado linguístico da Galiza e do Noroeste de Portugal desde o século XIII ao século XVI,Clarinda de Azevedo Maia,1
http://books.uc.pt/book?book=762,A Cultura Epigráfica no conuentus Bracaraugustanus (pars occidentalis): percursos pela sociedade brácara da época romana vol. I,Armando Redentor,1
http://books.uc.pt/book?book=782,Ceuta não foi conquista mas começo dela,João Marinho dos Santos,1
http://books.uc.pt/book?book=1024,Cidade e Religião: a colegiada de Santa Justa de Coimbra na Idade Média,Maria Amélia Álvaro de Campos,1
http://books.uc.pt/book?book=812,Manual Técnico do Nadador-Salvador,ISN,0
http://books.uc.pt/book?book=774,Obras de Maria Helena da Rocha Pereira: Arte antiga  - Volume IV,Maria Helena da Rocha Pereira,1
http://books.uc.pt/book?book=828,Obras de Maria Helena da Rocha Pereira: Arte Antiga - Volume IV,Maria Helena da Rocha Pereira,1
http://books.uc.pt/book?book=827,"Obras de Maria Helena da Rocha Pereira: Traduções do Grego Píndaro, Sófocles e Eurípedes -  Volume III",Maria Helena da Rocha Pereira,1
http://books.uc.pt/book?book=759,A Agenda da União Europeia sobre os Direitos e Garantias da Defesa em Processo Penal:a “segunda vaga” e o seu previsível impacto sobre o direito português,Pedro Caeiro,1
http://books.uc.pt/book?book=760,"A aventura da moeda única europeia: Enredos e dilemas, progressos e desafios. Ensaio de história e de política",António Martins da Silva,1
http://books.uc.pt/book?book=800,Introdução à Maçonaria,António Arnaut,1
http://books.uc.pt/book?book=802,La influencia de Os Lusíadas de Camões en la épica en castellano (1578-1627),Cidália Alves dos Santos,1
http://books.uc.pt/book?book=811,Manual de Investigação Qualitativa em Educação,João Amado,1
http://books.uc.pt/book?book=849,Recolha Poética (1954-2017),António Arnaut,1
http://books.uc.pt/book?book=775,Arte de falar e arte de estar calado: Augusto de Castro – Jornalismo e Diplomacia,Clara Isabel Serrano,1
http://books.uc.pt/book?book=786,Direito da eficiência energética,Suzana Tavares da Silva,1
http://books.uc.pt/book?book=856,"Ténis: estratégia, perceção e ação",Raul A. Martins,1
http://books.uc.pt/book?book=816,"Narrativa e Media: Géneros, Figuras e Contextos",Ana Teresa Peixinho,1
http://books.uc.pt/book?book=830,Ortega y Gasset em Lisboa: Tradução e enquadramento de La razón histórica [Curso de 1944],Margarida I. Almeida Amoedo,1
http://books.uc.pt/book?book=857,The edge of one many circles: Homenagem a Irene Ramalho Santos,Isabel Caldeira,1
http://books.uc.pt/book?book=859,,José Rodrigues da Costa,1
http://books.uc.pt/book?book=791,"Europa, Atlântico e o mundo: Mobilidades, crises, dinâmicas culturais. Pensar com Maria Manuela Tavares Ribeiro",Isabel Maria Freitas Valente,1
http://books.uc.pt/book?book=793,Fracasso e verdade na recepção de Políbio e Tucídides,Breno Battistin Sebastiani,1
http://books.uc.pt/book?book=826,O sangue de Bizâncio: ascensão e queda do império romano do oriente,João Gouveia Monteiro,1
http://books.uc.pt/book?book=778,"Avaliação Familiar. Vol. II: Vulnerabilidade, stress e adaptação - Impressão",Sofia Major,1
http://books.uc.pt/book?book=785,Diálogos Freireanos: A educação e formação de jovens e adultos em Portugal e no Brasil,Luís Alcoforado,1
http://books.uc.pt/book?book=807,Lições de matemática II,Teresa Pedroso de Lima,0
http://books.uc.pt/book?book=819,O Cinema no discurso do poder: Dicionário sobre legislação cinematográfica portuguesa (1896-1974),Jorge Seabra,1
http://books.uc.pt/book?book=765,"A esperança, utopia impossível? Da insatisfação como via do (que podemos) conhecer, e esperar, e devir",Sebastião J. Formosinho,1
http://books.uc.pt/book?book=817,Nexo de Causalidade e Estado Anterior na Avaliação Médico-Legal do Dano Corporal,Carina Oliveira,1
http://books.uc.pt/book?book=690,A água como património: experiências de requalificação das cidades com água e das paisagens fluviais,Paulo Peixoto,1
http://books.uc.pt/book?book=691,"A coleção de vasos gregos do instituto Gómez-Moreno: Fundação Rodríguez-A Costa, Granada",Rui Morais,1
http://books.uc.pt/book?book=702,"Arquéstrato, Iguarias do Mundo Grego: guia gastronómico do Mediterrâneo Antigo",Carmen Soares,1
http://books.uc.pt/book?book=713,Cosmópolis mobilidades culturais às origens do pensamento antigo,Gabriele Cornelli,1
http://books.uc.pt/book?book=720,"Estrabão, Geografia Livro III",,1
http://books.uc.pt/book?book=721,"Estrutura, personagens e enganos: introdução à leitura de As Báquides de Plauto",Cláudia Teixeira,1
http://books.uc.pt/book?book=728,"História da Diocese de Viseu, Vol. I, II e III",José Pedro Paiva,0
http://books.uc.pt/book?book=734,Manual de genética médica,Fernando Regateiro,1
http://books.uc.pt/book?book=747,Redes culturais nos primórdios da Europa. 2400 Anos da Fundação da Academia de Platão,Carmen Soares,1
http://books.uc.pt/book?book=751,"Teofrasto, História das plantas: tradução portuguesa, com introdução e anotação",Maria de Fátima Silva,1
http://books.uc.pt/book?book=752,Terramoto de Lisboa de 1755,Luciano Lourenço,1
http://books.uc.pt/book?book=695,A Faculdade de Direito de Coimbra em Retrospectiva,Rui de Figueiredo Marcos,1
http://books.uc.pt/book?book=700,Adília Lopes,,1
http://books.uc.pt/book?book=704,Bénédicte Houart,Hélder Gomes Cancela,1
http://books.uc.pt/book?book=729,História e ficção em Paul Ricoeur e Tucídides,Martinho Soares,1
http://books.uc.pt/book?book=736,Manuel António Pina,Rui Lage,1
http://books.uc.pt/book?book=741,Patrimónios alimentares aquém e além-mar,Joaquim Pinheiro,1
http://books.uc.pt/book?book=855,"Tempo, mythos e praxis: o diálogo entre Ricoeur, Agostinho e Aristóteles",Martinho Soares,1
http://books.uc.pt/book?book=698,A Linguagem na Pólis,João Corrêa-Cardoso,1
http://books.uc.pt/book?book=740,"Opera Omnia. Tomo I. Manuel Pimenta, S. J.",Sebastião Tavares de Pinho,1
http://books.uc.pt/book?book=708,Cadernos da Mediapolis [M2],João Figueira,1
http://books.uc.pt/book?book=716,Do Minho ao Mandovi: Um estudo sobre o pensamento colonial de Norton de Matos,Sérgio Neto,1
http://books.uc.pt/book?book=730,Interdisciplinaridade e Universidade,António Rafael Amaro,1
http://books.uc.pt/book?book=756,Vida da Faculdade de Letras 2015-2016,Faculdade de Letras da Universidade de Coimbra,1
http://books.uc.pt/book?book=689,A actualidade da pedagogia de João de Deus,Maria Helena Damião,1
http://books.uc.pt/book?book=711,"Compaixão, expiação e indiferença do Estado: notas sobre a tragédia de Entre-os-Rios",Pedro Araújo,1
http://books.uc.pt/book?book=717,Enseñar español en la actualidad: contribuciones didácticas,María Luisa Aznar Juan,1
http://books.uc.pt/book?book=719,Estética da comunicação musical - a improvisação,,0
http://books.uc.pt/book?book=725,"Geografia, cultura e riscos: livro de homenagem ao Prof. Doutor António Pedrosa",Luciano Lourenço,1
http://books.uc.pt/book?book=744,"Plan pour l’éducation d’un jeune seigneur russe: manuscrito de Ribeiro Sanches (1766): leitura, transcrição, tradução e comentários filológicos",Brian F. Head,1
http://books.uc.pt/book?book=732,Livros quinhentistas da coleção Visconde da Trindade,Maria da Graça Pericão,1
http://books.uc.pt/book?book=714,Curso de Direito da Família: volume I - Introdução: Direito matrimonial,Francisco Pereira Coelho,1
http://books.uc.pt/book?book=722,Estudos de Direito Internacional privado da União Europeia,Rui Manuel Moura Ramos,1
http://books.uc.pt/book?book=688,"Eu mesma matei meu filho: poéticas do trágico em Eurípides, Goethe e García Lorca",Claudio Castro Filho,1
http://books.uc.pt/book?book=726,"Geografia, paisagem e riscos: livro de homenagem ao Prof. Doutor António Pedrosa",Luciano Lourenço,1
http://books.uc.pt/book?book=733,Mafalala: memórias e espaços de um lugar,Margarida Calafate Ribeiro,1
http://books.uc.pt/book?book=737,Nanotecnociência e Humanidade,Monique Pyrrho,1
http://books.uc.pt/book?book=701,A eterna sedução da filha de Édipo. Antígona,Andrés Pociña,1
http://books.uc.pt/book?book=696,A fraude académica no ensino superior em Portugal,Filipe Almeida,1
http://books.uc.pt/book?book=694,Antígona. A eterna sedução da filha de Édipo,Andrés Pociña,1
http://books.uc.pt/book?book=706,Brigada de intervenção: 10 anos de afirmação,,0
http://books.uc.pt/book?book=710,Cem anos de Antropologia em Coimbra: 1885-1985,,1
http://books.uc.pt/book?book=715,D. Pedro e D. Inês: diálogos entre o amor e a morte,Maria Helena da Cruz Coelho,1
http://books.uc.pt/book?book=743,Pessoas de livro: estudos sobre a personagem,Carlos Reis,1
http://books.uc.pt/book?book=748,"Redes, capital humano e geografias da competitividade",Fátima Velez de Castro,1
http://books.uc.pt/book?book=705,Biodegradáveis. Ficheiros secretos,Ana Vitorino,1
http://books.uc.pt/book?book=707,By heart e outras peças curtas,Tiago Rodrigues,1
http://books.uc.pt/book?book=709,Cartas de Joaquim de Carvalho a Alfredo Pimenta: 1922-36,Paulo Archer de Carvalho,1
http://books.uc.pt/book?book=735,Manual Técnico do Nadador-Salvador,ISN,1
http://books.uc.pt/book?book=746,Processos físicos e modelos computacionais em engenharia costeira,José Simão Antunes do Carmo,1
http://books.uc.pt/book?book=692,A cultura do poder: a propaganda nos estados autoritários ,Alberto Pena-Rodríguez,1
http://books.uc.pt/book?book=727,Gramática derivacional do Português,Graça Rio-Torto,1
http://books.uc.pt/book?book=731,"Intervenção em Rede: serviço social, sistémica e redes de suporte social",Sónia Guadalupe,0
http://books.uc.pt/book?book=712,"Cor, natureza e conhecimento no curso Aristotélico Jesuíta conimbricense (1592‑1606)",Maria da Conceição Camps,1
http://books.uc.pt/book?book=738,O Instituto de Arqueologia: Fragmentos da sua colecção,Raquel Vilaça,1
http://books.uc.pt/book?book=739,"O processo de somatização: Conceitos, avaliação e tratamento",Manuel João Quartilho,1
http://books.uc.pt/book?book=745,Posso participar? Actividades de desenvolvimento pessoal para pessoas idosas,Margarida Pedroso de Lima,1
http://books.uc.pt/book?book=749,Ricoeur em Coimbra: Receção filosófica da sua obra,,1
http://books.uc.pt/book?book=750,Teatro do sacramento: a unidade teológico-retórico-política dos sermões de Antonio Vieira,Alcir Pécora,1
http://books.uc.pt/book?book=755,Vida da Faculdade de Letras 2014-2015,Faculdade de Letras da Universidade de Coimbra,1
http://books.uc.pt/book?book=757,,Manuel J Coelho e Silva,0
http://books.uc.pt/book?book=758,,Manuel J Coelho e Silva,0
http://books.uc.pt/book?book=697,A ilusão perfeita: holografia moderna na nova era dos meios digitais ,Martin J. Richardson,1
http://books.uc.pt/book?book=699,"Accountability no Terceiro Setor em Portugal Perspetivas, desafios e oportunidades",Andreia Filipa Gomes Ruela,1
http://books.uc.pt/book?book=724,Fraude e plágio na universidade: A urgência de uma cultura de integridade no Ensino Superior ,Filipe Almeida,1
http://books.uc.pt/book?book=753,Textos de Direito da Família: Para Francisco Pereira Coelho,Guilherme de Oliveira,1
http://books.uc.pt/book?book=754,"Viajando por Angola em 1969: Caderno de campo de um geógrafo: transcrição, ilustração, notas e comentários",Fernando Rebelo,1
http://books.uc.pt/book?book=718,Estatística para a melhoria de processos: a perspectiva seis sigma,,0
http://books.uc.pt/book?book=622,A recepção dos estudos clássicos em portugal e no brasil,Maria de Fátima Silva,1
http://books.uc.pt/book?book=624,A Universidade de Coimbra - Quadrilingue,Luís Reis Torgal,0
http://books.uc.pt/book?book=626,"Antologia Grega, Epigramas Ecfrásticos (Livros II e III)","Carlos A. M. Jesus
",1
http://books.uc.pt/book?book=634,Cadernos de Psiquiatria Social e Cultural #0,Isabel Fazenda,1
http://books.uc.pt/book?book=650,Helena,Alessandra Oliveira,1
http://books.uc.pt/book?book=653,Humanismo e ciência: antiguidade e renascimento,António Manuel Lopes Andrade,1
http://books.uc.pt/book?book=654,Idades e género na literatura e na arte da Grécia antiga,Ana Iriarte,1
http://books.uc.pt/book?book=657,Livro de Ouro do Município de Cantanhede,Maria Alegria Fernandes Marques,1
http://books.uc.pt/book?book=663,O Dinheiro,Maria de Fátima Silva,1
http://books.uc.pt/book?book=672,Realidades e desafios na gestão dos riscos: diálogo entre ciência e utilizadores,Luciano Lourenço,1
http://books.uc.pt/book?book=675,Sabores e segredos. Receituários Conventuais Portugueses da Época Moderna,,1
http://books.uc.pt/book?book=676,Sociologia do Risco: Uma breve introdução e algumas lições ,José Manuel Mendes,0
http://books.uc.pt/book?book=677,Sofrimentos de amor,Reina Marisol Pereira,1
http://books.uc.pt/book?book=684,Vasos Gregos da Coleção D. Manuel de Lancastre,Rui Morais,1
http://books.uc.pt/book?book=686,Vida da Faculdade de Letras (2012-2013),Faculdade de Letras da Universidade de Coimbra,1
http://books.uc.pt/book?book=687,Vida da Faculdade de Letras (2013-2014),Faculdade de Letras da Universidade de Coimbra,1
http://books.uc.pt/book?book=623,A saúde dos nossos antepassados: Um olhar sobre a paleopatologia,Jorge A. Suby,1
http://books.uc.pt/book?book=625,A Universidade de Coimbra: O tangível e o intangível,José de Faria Costa,0
http://books.uc.pt/book?book=641,"Empreendedorismo: Do conceito à aplicação, da ideia ao negócio, da tecnologia ao valor",Pedro Manuel Saraiva,1
http://books.uc.pt/book?book=662,Nos palcos da ciência: Uma apreciação estética da heterodoxia científica,Sebastião J. Formosinho,1
http://books.uc.pt/book?book=680,,Rui de Figueiredo Marcos,1
http://books.uc.pt/book?book=681,Três modernistas: arquitetura do modernismo em Portugal: uma síntese e alguns autores,José Manuel Fernandes,1
http://books.uc.pt/book?book=620,A fraude académica no Ensino Superior em Portugal: Um estudo sobre a ética dos alunos portugueses,Filipe Almeida,1
http://books.uc.pt/book?book=627,Aristóteles em Coimbra: Cursus Conimbricensis,Cristiano Casalini,1
http://books.uc.pt/book?book=628,Artes plásticas e crítica em Portugal nos anos 70 e 80: Vanguarda e pós-modernismo,Isabel Nogueira,0
http://books.uc.pt/book?book=630,As Regras da Regra de Santa Clara. Códice do século XVI,Maria José Azevedo Santos,1
http://books.uc.pt/book?book=635,Camões nos prelos de Portugal e da Europa (1563-2000): A Biblioteca Camoniana de D. Manuel II: A Biblioteca Camoniana da Fundação da Casa de Bragança,José Augusto Cardoso Bernardes,0
http://books.uc.pt/book?book=637,Crónicas ao Acaso,J. J. Pedroso de Lima,1
http://books.uc.pt/book?book=642,EMSURE: energy and mobility for sustainable regions,,1
http://books.uc.pt/book?book=643,Entre a periferia e o centro: Percursos de emigrantes portugueses qualificados,Rui Machado Gomes,1
http://books.uc.pt/book?book=644,"Filosofia Transcendental e a sua crítica: Idealismo, fenomenologia, hermenêutica ",Diogo Ferrer,1
http://books.uc.pt/book?book=666,Opera Omnia. Tomo II. Epistolografia,Sebastião Tavares de Pinho,1
http://books.uc.pt/book?book=667,Opera Omnia. Tomo III. Comentários aos provérbios de Salomão ,Sebastião Tavares de Pinho,1
http://books.uc.pt/book?book=670,Política externa: As relações internacionais em mudança,Maria Raquel Freire,0
http://books.uc.pt/book?book=674,Roteiro do plane(j)amento estratégico: percursos e encruzilhadas do Ensino Superior no espaço da Língua Portuguesa ,Margarida Mano,1
http://books.uc.pt/book?book=631,,,1
http://books.uc.pt/book?book=671,Princípios de genética forense,Francisco Corte-Real,1
http://books.uc.pt/book?book=673,Resumo Documental: uma incursão à (des)construção concetual na literatura científica,Maria da Graça Simões,1
http://books.uc.pt/book?book=678,Terramoto de Lisboa de 1755: O que aprendemos 260 anos depois?,Luciano Lourenço,1
http://books.uc.pt/book?book=679,Território e saúde mental em tempos de crise,Paula Santana,1
http://books.uc.pt/book?book=618,"A cruz, o gládio e a espada: Representações da História no cinema de Cecil B. DeMille",Elsa Maria Carneiro Mendes,1
http://books.uc.pt/book?book=668,Patrimónios de Influência Portuguesa: modos de olhar,Walter Rossa,1
http://books.uc.pt/book?book=648,"Guerra e Poder na Europa Medieval, das Cruzadas à Guerra dos 100 Anos",João Gouveia Monteiro,0
http://books.uc.pt/book?book=629,As Mulheres perante os tribunais do Antigo Regime na Península Ibérica,Margarita Torremocha Hernandéz,1
http://books.uc.pt/book?book=649,Guia de Fundos do Arquivo da Universidade de Coimbra,José Pedro Paiva,1
http://books.uc.pt/book?book=661,Nas Margens do Hindustão. O Estado da Índia e a expansão mogol ca. 1570-1640,Jorge Flores,1
http://books.uc.pt/book?book=616,A Biblioteca da Universidade: permanência e metamorfoses,José Augusto Cardoso Bernardes,1
