link,title,author,cc
http://books.uc.pt/book?book=418,Sons do clássico: no 100º aniversário de Maria Augusta Barbosa,J. M. Pedrosa Cardoso,1
http://books.uc.pt/book?book=419,Sousa Gomes e o ensino da química,J. Simões Redinha,1
http://books.uc.pt/book?book=341,A análise institucional do discurso como analítica da subjetividade,Marlene Guirado,0
http://books.uc.pt/book?book=342,A beleza e o mármore: o tratado de architectura de Vitrúvio e o Renascimento,,0
http://books.uc.pt/book?book=343,A consciência de um império: Portugal e o seu mundo (sécs. XV-XVII),Giuseppe Marcocci,0
http://books.uc.pt/book?book=344,A cor do centro histórico de Coimbra ,Pedro Francisco Mendes Pinheiro da Providência e Costa,0
http://books.uc.pt/book?book=349,A potência da aparência: um estudo sobre o prazer e a sensação nos Diálogos de Platão,Fernando Muniz,0
http://books.uc.pt/book?book=351,A sociologia de Talcott Parsons,José Maurício Domingues,0
http://books.uc.pt/book?book=358,As relações jugoslavo-portuguesas (1941-1974),Jorge Santos Carvalho,1
http://books.uc.pt/book?book=366,"Ecos do mundo zero: guia de interpretação de futuros, aliens e ciborgues",Elsa Margarida Rodrigues,0
http://books.uc.pt/book?book=368,Ensaios sobre o tempo na filosofia antiga,Fernando Ruy Puente,0
http://books.uc.pt/book?book=380,João de Castro Osório: tragédia e política,Ália Rosa C. Rodrigues,1
http://books.uc.pt/book?book=388,Memória coletiva e teoria social ,Myrian Sepúlveda dos Santos,0
http://books.uc.pt/book?book=394,O discurso da poesia concreta: uma abordagem semiótica,Antonio Vicente Pietroforte,0
http://books.uc.pt/book?book=395,O livro da capa verde: o regimento diamantino de 1771 e a vida no distrito diamantino no período da real extração,Junia Ferreira Furtado,0
http://books.uc.pt/book?book=396,O mal: homem culpado homem sofrido,Jerôme Poreé,0
http://books.uc.pt/book?book=397,O paganismo em Fernando Pessoa e sua projeção no mundo contemporâneo,E. M. de Melo e Castro,0
http://books.uc.pt/book?book=407,Património cultural e paisagístico,Paulo Carvalho,1
http://books.uc.pt/book?book=408,Platão,Franco Trabattoni,1
http://books.uc.pt/book?book=414,Ricardo Severo: da arqueologia portuguesa à arquitetura brasileira,Joana Mello,0
http://books.uc.pt/book?book=416,Segurança na construção PSS e CSS,Telmo Dias Pereira,0
http://books.uc.pt/book?book=417,Sic itvr in vrbem: iniciação ao latim,,0
http://books.uc.pt/book?book=421,Trabalho imaterial e produção cultural: a dialética do capitalismo tardio,Sílvio Camargo,0
http://books.uc.pt/book?book=423,"Um paradigma no céu: Platão político, de Aristóteles ao século XX",Mario Vegetti,0
http://books.uc.pt/book?book=424,Uma coisa na ordem das coisas: estudos para Ofélia Paiva Monteiro,Carlos Reis,0
http://books.uc.pt/book?book=350,A quarta missão da universidade: internacionalização universitária na sociedade do conhecimento,Fernando Seabra Santos,0
http://books.uc.pt/book?book=410,Poesia escolhida de José Jorge Letria,José Jorge Letria,0
http://books.uc.pt/book?book=365,"Eça de Queirós: riso, memória, morte",Joana Duarte Bernardes,0
http://books.uc.pt/book?book=345,A dúvida,Vilém Flusser,0
http://books.uc.pt/book?book=346,"A escola primária como rito de passagem: ler, escrever, contar e se comportar",Carlota Boto,0
http://books.uc.pt/book?book=347,A globalização no mundo antigo: do polites ao kosmopolites,Delfim F. Leão,1
http://books.uc.pt/book?book=348,A história do diabo,Vilém Flusser,0
http://books.uc.pt/book?book=355,Antonin Artaud: teatro e ritual,Cassiano Sydow Quilici,0
http://books.uc.pt/book?book=363,Dadá-Berlim: des/montagem,Norval Baitello Junior,0
http://books.uc.pt/book?book=382,Língua e realidade,Vilém Flusser,0
http://books.uc.pt/book?book=386,Manual de computação evolutiva e metaheurística,António Gaspar-Cunha,0
http://books.uc.pt/book?book=387,,,0
http://books.uc.pt/book?book=393,O corpo: pistas para estudos indisciplinares,Christine Greiner,0
http://books.uc.pt/book?book=399,O teatro grego em contexto de representação,Isabel Castiajo,0
http://books.uc.pt/book?book=400,O universo das imagens técnicas,Vilém Flusser,0
http://books.uc.pt/book?book=403,"Ouvido, ondas e vibrações: aspectos físicos e biofísicos",J. J. Pedroso de Lima,0
http://books.uc.pt/book?book=411,Portugal e o Piemonte: a casa real portuguesa e os Sabóias: nove séculos de relações dinásticas e destinos políticos (XII-XX),Maria Antónia Lopes,1
http://books.uc.pt/book?book=425,Vampyroteuthis infernalis,Vilém Flusser,0
http://books.uc.pt/book?book=429,Vidas paralelas: Demóstenes e Cícero,Marta Isabel de Oliveira Várzeas,1
http://books.uc.pt/book?book=354,Análise dos media,Isabel Ferin Cunha,1
http://books.uc.pt/book?book=369,Escrever... com normas: guia prático para elaboração de trabalhos técnico-científicos,Julce Mary Cornelsen,0
http://books.uc.pt/book?book=412,,Fernanda Cravidão,1
http://books.uc.pt/book?book=370,Espaços e paisagens: Antiguidade Clássica e heranças contemporâneas: vol. I: línguas e literaturas: Grécia e Roma,Francisco de Oliveira,1
http://books.uc.pt/book?book=371,Espaços e paisagens: Antiguidade Clássica e heranças contemporâneas: vol. II: línguas e literaturas: Idade Média: Renascimento: recepção,Francisco de Oliveira,1
http://books.uc.pt/book?book=372,"Espaços e paisagens: Antiguidade Clássica e heranças contemporâneas: vol. III: história, arqueologia e arte",Francisco de Oliveira,1
http://books.uc.pt/book?book=376,Grandes conflitos da história da Europa: de Alexandre Magno a Guilherme “o Conquistador”,João Gouveia Monteiro,0
http://books.uc.pt/book?book=377,Hidráulica urbana: sistemas de abastecimento de águas e drenagem de águas residuais,José Alfeu Sá Marques,0
http://books.uc.pt/book?book=409,"Plutarco e as artes: pintura, cinema e artes decorativas",Luísa de Nazaré Ferreira,1
http://books.uc.pt/book?book=413,Representações da cidade antiga: categorias históricas e discursos filosóficos,Gabriele Cornelli,0
http://books.uc.pt/book?book=427,Vidas de Galba e Otão,José Luís Brandão,0
http://books.uc.pt/book?book=428,Vidas paralelas: Alcibíades e Coriolano,Maria do Céu Fialho,1
http://books.uc.pt/book?book=352,A Universidade de Coimbra e o Brasil,José Pedro Paiva,1
http://books.uc.pt/book?book=359,As três religiões do livro,Anselmo Borges,1
http://books.uc.pt/book?book=362,Da bolsa e suas operações,Maria Eugénia Mata,0
http://books.uc.pt/book?book=364,Do oitavo passageiro ao clone número oito,Elsa Margarida Rodrigues,0
http://books.uc.pt/book?book=389,Memórias políticas: memória das coisas mais notáveis que se trataram nas conferências do Governo (1810-1820),Ricardo Raimundo Nogueira,0
http://books.uc.pt/book?book=392,O Algarve na época moderna | Miunças 2,Joaquim Romero Magalhães,0
http://books.uc.pt/book?book=402,Ordenamento e desenvolvimento territorial,Paulo Carvalho,1
http://books.uc.pt/book?book=420,"Teoria da arte no século XX: modernismo, vanguarda, neovanguarda, pós-modernismo ",Isabel Nogueira,0
http://books.uc.pt/book?book=422,Três peças mitocríticas I: um Édipo - o drama ocultado. Mitodrama fantasmático em um acto,Armando Nascimento Rosa,0
http://books.uc.pt/book?book=281,A colecção de lucernas romanas do Museu de Évora,Rui Morais,1
http://books.uc.pt/book?book=282,A colecção de vasos gregos do Museu de Farmácia,Rui Morais,1
http://books.uc.pt/book?book=290,África nossa: o império colonial na ficção cinematográfica portuguesa (1945-1974),Jorge Seabra,0
http://books.uc.pt/book?book=299,Chancelaria de D. Afonso III. Livros II e III,Leontina Ventura,0
http://books.uc.pt/book?book=328,"Psicologia das Organizações, do Trabalho e dos Recursos Humanos - Capa Dura",A. Duarte Gomes,0
http://books.uc.pt/book?book=334,,J. J. Pedroso de Lima,0
http://books.uc.pt/book?book=285,A poesia de Martim de Castro do Rio (c. 1548-1613),Mafalda Ferin Cunha,0
http://books.uc.pt/book?book=287,A vida nas escolas: casos para a formação de professores/La práctica cotidiana enlos colegios: casos para la formación de docentes,Ana Rodríguez Marcos,0
http://books.uc.pt/book?book=298,Causa pública,Rita Marnoto,1
http://books.uc.pt/book?book=303,Da bolsa e suas operações,Maria Eugénia Mata,0
http://books.uc.pt/book?book=304,Da bolsa e suas operações,Maria Eugénia Mata,0
http://books.uc.pt/book?book=306,"Darwin, Evolution, Evolutionisms",Ana Leonor Pereira,0
http://books.uc.pt/book?book=309,"Educação e formação de adultos: políticas, práticas e investigação",Luís Alcoforado,0
http://books.uc.pt/book?book=313,Estudos de linguística I,Ana R. Luís,0
http://books.uc.pt/book?book=317,Manuel de Arriaga: o primeiro reitor da Universidade de Coimbra na república,Teresa Baptista,0
http://books.uc.pt/book?book=320,O ensino do português: como tudo começou,Luísa Carvalho,0
http://books.uc.pt/book?book=321,O fascismo catedrático de Salazar,Jorge Pais de Sousa,0
http://books.uc.pt/book?book=323,Órgãos de tubos em Portugal: mosteiro de Semide,Edite Rocha,0
http://books.uc.pt/book?book=333,Sementes de ciência: livro de homenagem a António Marinho Amorim da Costa,Sebastião J. Formosinho,1
http://books.uc.pt/book?book=336,Terravita sadia infantil,Maria Helena Henriques,1
http://books.uc.pt/book?book=337,Terravita sadia juvenil,Maria José Moreno,1
http://books.uc.pt/book?book=339,Três peças mitocríticas III: o eunuco de Inês de Castro. Teatro no país dos mortos,Armando Nascimento Rosa,0
http://books.uc.pt/book?book=289,Acordo ortográfico 2011: o que mudou no português europeu,Isabel Poço Lopes,1
http://books.uc.pt/book?book=335,Teatro tomo II: vida humana,Sebastião Tavares de Pinho,0
http://books.uc.pt/book?book=338,Tesouros da biblioteca geral da Universidade de Coimbra,A. E. Maia do Amaral,1
http://books.uc.pt/book?book=340,"Trunfos de uma geografia activa: desenvolvimento local, ambiente, ordenamento e tecnologia",Norberto Santos,1
http://books.uc.pt/book?book=284,A individuação da sociedade moderna: investigações semânticas sobre a diferenciação da sociedade moderna,Edmundo Balsemão Pires,0
http://books.uc.pt/book?book=295,Cálculo: peça em dois actos,Carl Djerassis,0
http://books.uc.pt/book?book=314,Hidráulica urbana: sistemas de abastecimento de águas e drenagem de águas residuais,José Alfeu Sá Marques,0
http://books.uc.pt/book?book=315,"Impressões sobre a música portuguesa: panorama, criação, interpretação, esperanças",José Eduardo Martins,0
http://books.uc.pt/book?book=318,Modelação de sistemas geológicos: livro de homenagem ao Professor Manuel Maria Godinho        ,,0
http://books.uc.pt/book?book=319,Norma e transgressão II,Carmen Soares,1
http://books.uc.pt/book?book=322,Orações de sapiência 1548-1555,Maria Helena da Rocha Pereira,0
http://books.uc.pt/book?book=331,"República, republicanismo e republicanos: Brasil, Portugal, Itália",Armando Malheiro da Silva,1
http://books.uc.pt/book?book=280,1910-2010: Comunicação e educação republicanas,Ana Teresa Peixinho,1
http://books.uc.pt/book?book=302,"Crónicas de história, cultura e cidadania",João Gouveia Monteiro,0
http://books.uc.pt/book?book=307,Direitos fundamentais na arena global,Suzana Tavares da Silva,0
http://books.uc.pt/book?book=316,Lições de Direito Administrativo,José Vieira de Andrade,0
http://books.uc.pt/book?book=327,"Psicologia das organizações, do trabalho e dos recursos humanos - Brochada",A. Duarte Gomes,0
http://books.uc.pt/book?book=286,A popularização da cultura republicana (1881-1910),Lia Ribeiro,0
http://books.uc.pt/book?book=288,,Karen Bennett,0
http://books.uc.pt/book?book=292,Alto Trás-os-Montes,,0
http://books.uc.pt/book?book=311,"Empreendedorismo: do conceito à aplicação, da ideia ao negócio, da tecnologia ao valor",Pedro Manuel Saraiva,1
http://books.uc.pt/book?book=332,Ritmos do jardim botânico da Universidade de Coimbra,Ana Cristina Tavares,1
http://books.uc.pt/book?book=308,"Eça de Queirós: riso, memória, morte",Joana Duarte Bernardes,0
http://books.uc.pt/book?book=310,"Empreendedorismo: do conceito à aplicação, da ideia ao negócio, da tecnologia ao valor",Pedro Manuel Saraiva,1
http://books.uc.pt/book?book=326,Profissões e identidades profissionais ,Clara Cruz Santos,0
http://books.uc.pt/book?book=283,A história química de uma vela: curso de seis lições,Michael Faraday,0
http://books.uc.pt/book?book=296,Caminhos de ciência,António Piedade,0
http://books.uc.pt/book?book=300,"Cidadania, políticas públicas e redes sociais",Sílvia Portugal,0
http://books.uc.pt/book?book=301,Concelhos e a organização municipal na época moderna | Miunças 1,Joaquim Romero Magalhães,0
http://books.uc.pt/book?book=312,Estereoquímica,Maria Elisa da Silva Serra,0
http://books.uc.pt/book?book=325,Portugal 1974: transição política em perspectiva histórica,Rui Cunha Martins,0
http://books.uc.pt/book?book=330,Quantal aspects in Chemistry and Physics: a tribute to the memory of Professor Couceiro da Costa,J. Simões Redinha,0
http://books.uc.pt/book?book=291,Alexandre Magno: a paixão da guerra,,0
http://books.uc.pt/book?book=293,Baluartes da fé e da disciplina: o enlace entre a Inquisição e os bispos em Portugal (1536-1750),José Pedro Paiva,0
http://books.uc.pt/book?book=329,Psicologia vocacional: perspectivas para a intervenção,Maria do Céu Taveira,0
http://books.uc.pt/book?book=324,Política externa: as relações internacionais em mudança,Maria Raquel Freire,0
http://books.uc.pt/book?book=227,Como nos tornámos humanos,Eugénia Cunha,0
http://books.uc.pt/book?book=229,D. Francisco Manuel de Melo e o Barroco Peninsular,Marta Teixeira Anacleto,1
http://books.uc.pt/book?book=230,Diplomatário da Sé de Viseu (1078-1278),Leontina Ventura,0
http://books.uc.pt/book?book=243,Histologia: texto e imagens,Carlos Gonçalves,0
http://books.uc.pt/book?book=249,"La Terre dans le monde romain: anthropologie, droit, géographie",Gérard Chouquer,0
http://books.uc.pt/book?book=267,"Portas adentro: comer, vestir a habitar na Península Ibérica (ss. XVI-XIX)",Isabel dos Guimarães Sá,0
http://books.uc.pt/book?book=228,Como nos tornámos humanos,Eugénia Cunha,0
http://books.uc.pt/book?book=260,O arquitecto azul,Jorge Figueira,0
http://books.uc.pt/book?book=215,A contra-revolução na I República (1910-1919),,0
http://books.uc.pt/book?book=240,Estas máquinas chamadas mundos: breve manual de instruções para fabricar planetas e mantê-los em bom estado de funcionamento,E. Ivo Alves,0
http://books.uc.pt/book?book=241,Esterilidade e procriação medicamente assistida,Ana Teresa Almeida Santos,0
http://books.uc.pt/book?book=247,"Intervenção em rede: serviço social, sistémica e redes de suporte social",Sónia Guadalupe,0
http://books.uc.pt/book?book=250,Le mal du récit: ensaios sobre a novelística francesa dos séculos XIX e XX,Cristina Robalo Cordeiro,0
http://books.uc.pt/book?book=252,Lições de direito administrativo,José Vieira de Andrade,0
http://books.uc.pt/book?book=257,Museus para o povo português,Joana Damasceno,0
http://books.uc.pt/book?book=259,Novos tipos de família: planos de cuidados,Hernâni Caniço,0
http://books.uc.pt/book?book=219,Biotecnologia vegetal da clonagem de plantas à transformação genética,Jorge M. Canhoto,0
http://books.uc.pt/book?book=221,Cadernos de Literatura Medieval - CLP: a prosa didáctica medieval,Marta Teixeira Anacleto,0
http://books.uc.pt/book?book=222,Cadernos de Literatura medieval - CLP: o contexto hispânico da historiografia portuguesa dos séculos XIII e XIV,Maria do Rosário Ferreira,0
http://books.uc.pt/book?book=225,CiênciaCidade,M. Paula Serra de Oliveira,1
http://books.uc.pt/book?book=234,Drama e comunicação,Paulo Filipe Monteiro,0
http://books.uc.pt/book?book=237,Energia em sinfonia,Maria Helena Henriques,1
http://books.uc.pt/book?book=254,Lógica,Amândio Coxito,0
http://books.uc.pt/book?book=272,Relations of the self,Edmundo Balsemão Pires,0
http://books.uc.pt/book?book=274,Saúde mental,Manuel João Quartilho,0
http://books.uc.pt/book?book=279,,Manuel J Coelho e Silva,0
http://books.uc.pt/book?book=216,Acta Medicinae Legalis et Socialis,Duarte Nuno Vieira,0
http://books.uc.pt/book?book=233,Doutoramento honoris causa de Jorge Sampaio,,1
http://books.uc.pt/book?book=235,Economia monetária e financeira,José Soares da Fonseca,0
http://books.uc.pt/book?book=245,História breve da pintura ocidental,Fernando Montesinos,0
http://books.uc.pt/book?book=261,"O conforto pelas imagens mentais na depressão, ansiedade e stresse",João Luís Alves Apóstolo,0
http://books.uc.pt/book?book=273,Religião e diálogo inter-religioso,Anselmo Borges,0
http://books.uc.pt/book?book=231,Direito administrativo europeu,Suzana Tavares da Silva,0
http://books.uc.pt/book?book=271,Reflexões sobre a liberdade: 150 anos da obra de John Stuart Mill,Carlos Camponez,0
http://books.uc.pt/book?book=218,Biofísica médica: exercícios práticos,J. J. Pedroso de Lima,0
http://books.uc.pt/book?book=248,João Soares de Brito: um crítico barroco de Camões,José Manuel Ventura,1
http://books.uc.pt/book?book=263,Outros combates pela História,Maria Manuel Tavares Ribeiro,0
http://books.uc.pt/book?book=276,Simmel: a estética e a cidade,Carlos Fortuna,0
http://books.uc.pt/book?book=223,Castelos em Portugal: retrato do seu perfil arquitectónico [1509-1949],Luís Miguel Correia,1
http://books.uc.pt/book?book=244,História breve da música ocidental,José Maria Pedrosa Cardoso,0
http://books.uc.pt/book?book=246,História da unificação europeia: a integração comunitária (1945-2010),António Martins da Silva,0
http://books.uc.pt/book?book=258,Novos tipos de família: plano de cuidados,Hernâni Caniço,0
http://books.uc.pt/book?book=264,Pequeno atlas do sistema solar,E. Ivo Alves,0
http://books.uc.pt/book?book=265,Peregrinações: quadros inspirados em “Peregrinação” de Fernão Mendes Pinto ,João Maria André,0
http://books.uc.pt/book?book=217,Alfabeto de Paul Valéry,Cristina Robalo Cordeiro,0
http://books.uc.pt/book?book=220,Breve história da ciência em Portugal,Carlos Fiolhais,1
http://books.uc.pt/book?book=226,Cogumelos do paul de Madriz,Anabela Marisa Azul,0
http://books.uc.pt/book?book=238,Envelhecimento(s),Margarida Pedroso de Lima,1
http://books.uc.pt/book?book=242,Geografia física e riscos naturais,Fernando Rebelo,0
http://books.uc.pt/book?book=251,Lições de álgebra linear,Teresa Pedroso de Lima,0
http://books.uc.pt/book?book=266,Plantas aromáticas e medicinais,Ana Cristina Tavares,0
http://books.uc.pt/book?book=277,Um novo direito administrativo?,Suzana Tavares da Silva,0
http://books.uc.pt/book?book=232,Do intervencionismo ao sidonismo: os dois segmentos da política de guerra na 1.ª República: 1916-1918,Luís Alves de Fraga,0
http://books.uc.pt/book?book=253,Localização dinâmica: modelos e técnicas,Joana Matos Dias,0
http://books.uc.pt/book?book=255,Logística,João Paulo Costa,0
http://books.uc.pt/book?book=270,"Quilómetros, euros e pouca terra",Daniel Murta,1
http://books.uc.pt/book?book=224,Ciência e mito,António Amorim da Costa,0
http://books.uc.pt/book?book=236,Educação filosófica: sete ensaios,João Boavida,1
http://books.uc.pt/book?book=239,Epigrafia: as pedras que falam,,0
http://books.uc.pt/book?book=262,"O estado novo e o volfrâmio (1933-1947): actividade mineira, ""grande depressão"" e segunda guerra mundial",João Paulo Avelãs Nunes,0
http://books.uc.pt/book?book=275,Sílvio Lima e o desporto,Pedro Falcão,0
http://books.uc.pt/book?book=278,Violência e abuso: respostas simples para questões complexas,Teresa Magalhães,1
http://books.uc.pt/book?book=256,Membros Portugueses da Royal Society,Carlos Fiolhais,1
http://books.uc.pt/book?book=268,Portugal e Itália: relações diplomáticas (1943-1974),Vera de Matos,0
http://books.uc.pt/book?book=169,A ciência da informação criadora do conhecimento: vol. II,Maria Manuel Borges,0
http://books.uc.pt/book?book=189,"Estados Novos, Estado Novo: vol II (2.ª Edição)",Luís Reis Torgal,0
http://books.uc.pt/book?book=195,Hidráulica urbana: sistemas de abastecimento de água e drenagem de águas residuais,Joaquim José de Oliveira Sousa,0
http://books.uc.pt/book?book=177,AAC: rostos do poder,João Pedro Campos,0
http://books.uc.pt/book?book=178,Acção social escolar na Universidade de Coimbra,António Luzio Vaz,0
http://books.uc.pt/book?book=183,Cuontas de la dona Tierra,Maria Helena Henriques,1
http://books.uc.pt/book?book=168,A ciência da informação criadora do conhecimento: vol. I,Maria Manuel Borges,0
http://books.uc.pt/book?book=171,A Escola de Farmácia de Coimbra (1902-1911),João Rui Pita,0
http://books.uc.pt/book?book=175,A Universidade de Coimbra: o tangível e o intangível,José de Faria Costa,0
http://books.uc.pt/book?book=170,A crise financeira internacional,Fernando Alexandre,0
http://books.uc.pt/book?book=180,Campos de concentração em Cabo Verde: as ilhas como espaços de deportação e de prisão no Estado Novo,Victor Barros,0
http://books.uc.pt/book?book=182,Correspondência latina,Damião de Góis,0
http://books.uc.pt/book?book=187,"Estados Novos, Estado Novo I: Ensaios de História Política e Cultural",Luís Reis Torgal,0
http://books.uc.pt/book?book=186,"Estados Novos, Estado Novo: vol I",Luís Reis Torgal,0
http://books.uc.pt/book?book=188,"Estados Novos, Estado Novo: vol II",Luís Reis Torgal,0
http://books.uc.pt/book?book=191,Fundamentos de balanços de energia,Isabel M. A. Fonseca,1
http://books.uc.pt/book?book=192,Génese e consolidação da ideia de Europa IV: Idade Média e Renascimento,Nair de Castro Soares,0
http://books.uc.pt/book?book=193,"Gestão de workflows: modelos, métodos e sistemas",Wil van der Aalst,0
http://books.uc.pt/book?book=194,Guia ilustrado das macroalgas,Leonel Pereira,0
http://books.uc.pt/book?book=198,,Marta Simões,0
http://books.uc.pt/book?book=200,Músicas do mundo,José Eduardo Braga,1
http://books.uc.pt/book?book=214,"Youth sports: participation, trainability and readiness",Manuel J Coelho e Silva,0
http://books.uc.pt/book?book=181,"Colónia mártir, colónia modelo: Cabo Verde no pensamento ultramarino português: 1925-1965",Sérgio Neto,1
http://books.uc.pt/book?book=197,Invertebrados de água doce: chave de identificação das principais famílias,Sónia Serra,0
http://books.uc.pt/book?book=199,Mudanças no uso do solo,António Campar de Almeida,1
http://books.uc.pt/book?book=206,,Henrique Jales Ribeiro,0
http://books.uc.pt/book?book=208,Teatro I: sedecias,Manuel José de Sousa Barbosa,0
http://books.uc.pt/book?book=190,Estudos do Património: museus e educação,J. Amado Mendes,1
http://books.uc.pt/book?book=201,Obra Literária I: prosa latina,Telmo Corujo dos Reis,0
http://books.uc.pt/book?book=202,Obra Literária II: poesia latina,Telmo Corujo dos Reis,0
http://books.uc.pt/book?book=174,A taxa de juro overnight e a sua volatilidade,Fátima Sol Murta,0
http://books.uc.pt/book?book=210,"Teófilo Braga, Ramalho Ortigão, Antero de Quental: diálogos difíceis",Amadeu Carvalho Homem,0
http://books.uc.pt/book?book=212,Vamos cuidar da Terra,Anabela Marisa Azul,0
http://books.uc.pt/book?book=213,Vegécio: compêndio da arte militar,João Gouveia Monteiro,0
http://books.uc.pt/book?book=173,A recepção de Freud em Portugal (1900-1956),Alírio Queirós,0
http://books.uc.pt/book?book=196,"Intervenção em rede: serviço social, sistémica e redes de suporte social",Sónia Guadalupe,0
http://books.uc.pt/book?book=204,Protecção social em Portugal na Idade Moderna,Maria Antónia Lopes,1
http://books.uc.pt/book?book=205,Reais hospitais militares em Portugal (1640-1834),Augusto Moutinho Borges,0
http://books.uc.pt/book?book=209,Técnicas de diagnóstico com raios X: aspectos físicos e biofísicos,J. J. Pedroso de Lima,0
http://books.uc.pt/book?book=179,As antiguidades da Lusitânia,,0
http://books.uc.pt/book?book=203,Opera Omnia I: Paráfrases a Job e à sabedoria de Salomão,António Guimarães Pinto,0
http://books.uc.pt/book?book=211,Utopias e distopias,Maria de Fátima Silva,0
http://books.uc.pt/book?book=184,Diálogo sobre a missão dos embaixadores Japoneses à Cúria Romana: Tomo I (Colóquios I-XVIII),Duarte de Sande,0
http://books.uc.pt/book?book=185,Diálogo sobre a missão dos embaixadores Japoneses à Cúria Romana: Tomo II (Colóquios XIX-XXXIV),Duarte de Sande,0
http://books.uc.pt/book?book=207,Still reading Hegel: 200 years after the phenomenology of spirit,Edmundo Balsemão Pires,0
http://books.uc.pt/book?book=172,A ideologia aristocrática nos Theognidea,Glória Onelley,1
http://books.uc.pt/book?book=176,A vida e a obra de Carolina Michaëlis de Vasconcelos: evocação e homenagem,Maria Manuela Gouveia Delille,0
http://books.uc.pt/book?book=132,A mesma origem nocturna: esculturas de Rui Chafes no Jardim Botânico,António Filipe Pimentel,0
http://books.uc.pt/book?book=137,"Ciências da educação: epistemologia, identidade e perspectivas",João Amado,0
http://books.uc.pt/book?book=144,Estatutos da Universidade de Coimbra,Faculdade de Letras da Universidade de Coimbra,0
http://books.uc.pt/book?book=147,Guia prático para a identificação de plantas invasoras de Portugal continental,Elizabete Marchante,0
http://books.uc.pt/book?book=158,Ortopedia e traumatologia: noções essenciais,,0
http://books.uc.pt/book?book=161,Philosophy in society virtues and values in Plutarch,José Ribeiro Ferreira,0
http://books.uc.pt/book?book=162,Plantas aromáticas e medicinais da escola médica do Jardim Botânico da Universidade de Coimbra,Ana Cristina Tavares,0
http://books.uc.pt/book?book=164,Psicologia vocacional: perspectivas para a intervenção,Maria do Céu Taveira,0
http://books.uc.pt/book?book=133,António Ferrer Correia: uma fotobiografia,Maria Antónia Lopes,1
http://books.uc.pt/book?book=151,Lazer: da libertação do tempo à conquista das práticas,Norberto Santos,1
